{
  "$schema": "../../schemas/runtime_completion/prompt-manifest.schema.json",
  "schema_version": "1.0.0",
  "program_version": "1.0.0",
  "program_name": "AURA Runtime Completion Program",
  "shared_contract": "prompts/runtime_completion/SHARED_EXECUTION_CONTRACT.md",
  "state_file": "ledger/runtime_completion/current-state.json",
  "handoff_file": "anti_amnesia/runtime_completion/session-handoff.json",
  "prompts": [
    {
      "order": 0,
      "id": "BOOTSTRAP",
      "name": "Session Bootstrap and Baseline Reconciliation",
      "file": "prompts/runtime_completion/00_SESSION_BOOTSTRAP.prompt.md",
      "dependencies": [],
      "completion_gate": "Live repository state, toolchain, authority, schemas, anti-amnesia files, capability matrix, and program state are reconciled. R0 is marked ready only when no false baseline remains.",
      "state_outputs": [
        "ledger/runtime_completion/current-state.json",
        "anti_amnesia/runtime_completion/session-handoff.json",
        "ledger/runtime_completion/PROGRAM_LEDGER.md",
        "ledger/runtime_completion/EVIDENCE_INDEX.md"
      ],
      "optional_context": [
        "docs/roadmap/AURA_FULLY_OPERATIONAL_ASSISTANT_MASTER_PLAN.md",
        "ledger/CURRENT_STATE.md",
        "SESSION_STARTER.md"
      ]
    },
    {
      "order": 1,
      "id": "R0",
      "name": "Repository Truth and Governance Repair",
      "file": "prompts/runtime_completion/01_R0_REPOSITORY_TRUTH_AND_GOVERNANCE.prompt.md",
      "dependencies": ["BOOTSTRAP"],
      "completion_gate": "Repository status is machine-projectable and contradiction-resistant; toolchain and evidence rules are verified; stale completion claims cannot pass CI.",
      "state_outputs": [
        "ledger/runtime_completion/current-state.json",
        "ledger/runtime_completion/capability-matrix.json",
        "ledger/runtime_completion/PROGRAM_LEDGER.md",
        "anti_amnesia/runtime_completion/session-handoff.json"
      ],
      "optional_context": [
        "ledger/CURRENT_STATE.md",
        "SESSION_STARTER.md",
        "ledger/PROJECT_LEDGER.md",
        "ledger/DECISION_INDEX.md"
      ]
    },
    {
      "order": 2,
      "id": "R1",
      "name": "Runtime Integration Spine and Trace Correctness",
      "file": "prompts/runtime_completion/02_R1_RUNTIME_INTEGRATION_SPINE.prompt.md",
      "dependencies": ["R0"],
      "completion_gate": "One production request preserves a truthful correlated trace through input, intent, policy, confirmation, execution, verification, response, and persistence; runtime health exposes unavailable modules.",
      "state_outputs": [
        "ledger/runtime_completion/current-state.json",
        "ledger/runtime_completion/capability-matrix.json",
        "ledger/runtime_completion/EVIDENCE_INDEX.md",
        "anti_amnesia/runtime_completion/session-handoff.json"
      ],
      "optional_context": [
        "Sources/AURA/AuraKernel.swift",
        "Sources/AuraIntent/IntentDispatchCoordinator.swift",
        "Sources/AuraIntent/ToolRouter.swift",
        "Sources/AuraAgent/Conversation.swift"
      ]
    },
    {
      "order": 3,
      "id": "R2",
      "name": "Bilingual NLU and Dialogue",
      "file": "prompts/runtime_completion/03_R2_BILINGUAL_NLU_AND_DIALOGUE.prompt.md",
      "dependencies": ["R1"],
      "completion_gate": "AURA understands natural Turkish, English, and mixed speech/text, produces model-backed conversation, performs safe clarification, and never routes unvalidated model output to execution.",
      "state_outputs": [
        "ledger/runtime_completion/current-state.json",
        "ledger/runtime_completion/capability-matrix.json",
        "ledger/runtime_completion/EVIDENCE_INDEX.md",
        "anti_amnesia/runtime_completion/session-handoff.json"
      ],
      "optional_context": [
        "Sources/AuraIntent/IntentEngine.swift",
        "Sources/AuraIntent/TypedIntent.swift",
        "Sources/AuraAgent/OllamaAdapter.swift",
        "Sources/AuraContext/ContextBuilder.swift"
      ]
    },
    {
      "order": 4,
      "id": "R3",
      "name": "Capability Registry and Typed Planner",
      "file": "prompts/runtime_completion/04_R3_CAPABILITY_REGISTRY_AND_PLANNER.prompt.md",
      "dependencies": ["R2"],
      "completion_gate": "All user-reachable actions are represented by registered typed capability manifests; validated single- and multi-step plans execute only through policy, confirmation, and verification boundaries.",
      "state_outputs": [
        "ledger/runtime_completion/current-state.json",
        "ledger/runtime_completion/capability-matrix.json",
        "ledger/runtime_completion/EVIDENCE_INDEX.md",
        "anti_amnesia/runtime_completion/session-handoff.json"
      ],
      "optional_context": [
        "Sources/AuraIntent/ToolRouter.swift",
        "Sources/AuraPolicy",
        "Sources/AuraCore/IntentPolicyTypes.swift"
      ]
    },
    {
      "order": 5,
      "id": "R4",
      "name": "Computer-Use Productization",
      "file": "prompts/runtime_completion/05_R4_COMPUTER_USE_PRODUCTIZATION.prompt.md",
      "dependencies": ["R3"],
      "completion_gate": "A production planner can complete bounded tasks in approved applications with fresh observation, typed actions, policy checks, resumable confirmation, secure-field blocking, emergency stop, and live evidence.",
      "state_outputs": [
        "ledger/runtime_completion/current-state.json",
        "ledger/runtime_completion/capability-matrix.json",
        "ledger/runtime_completion/EVIDENCE_INDEX.md",
        "anti_amnesia/runtime_completion/session-handoff.json"
      ],
      "optional_context": [
        "Sources/AuraComputerUse/ComputerUseControlLoop.swift",
        "Sources/AuraComputerUse/UIActionExecuting.swift",
        "Sources/AuraScreen/ScreenContextEngine.swift"
      ]
    },
    {
      "order": 6,
      "id": "R5",
      "name": "Browser, Mail, Calendar, and Contacts Adapters",
      "file": "prompts/runtime_completion/06_R5_BROWSER_MAIL_CALENDAR_ADAPTERS.prompt.md",
      "dependencies": ["R3"],
      "completion_gate": "Structured read-first personal-productivity workflows are operational; mutation and send actions use least-privilege scopes, reviewed drafts, bound confirmation, injection defenses, and independent verification.",
      "state_outputs": [
        "ledger/runtime_completion/current-state.json",
        "ledger/runtime_completion/capability-matrix.json",
        "ledger/runtime_completion/EVIDENCE_INDEX.md",
        "anti_amnesia/runtime_completion/session-handoff.json"
      ],
      "optional_context": [
        "docs/security/30_THREAT_MODEL.md",
        "Sources/AuraSecurity/NetworkAllowlist.swift",
        "Sources/AuraPolicy"
      ]
    },
    {
      "order": 7,
      "id": "R6",
      "name": "VS Code and Coding-Agent Completion",
      "file": "prompts/runtime_completion/07_R6_VSCODE_AND_CODING_AGENTS.prompt.md",
      "dependencies": ["R3"],
      "completion_gate": "VS Code policy is enforced; an authenticated bridge supports workspace, diagnostics, tasks, tests, and terminal state; coding-agent tasks are durable, bounded, reviewable, and evidence-backed.",
      "state_outputs": [
        "ledger/runtime_completion/current-state.json",
        "ledger/runtime_completion/capability-matrix.json",
        "ledger/runtime_completion/EVIDENCE_INDEX.md",
        "anti_amnesia/runtime_completion/session-handoff.json"
      ],
      "optional_context": [
        "Sources/AuraVSCode/VSCodeAdapter.swift",
        "Sources/AuraAgent/CodexAdapter.swift",
        "Sources/AuraAgent/WorktreeManager.swift",
        "Sources/AuraTasks"
      ]
    },
    {
      "order": 8,
      "id": "R7",
      "name": "Wake Word, STT/TTS Routing, and Resource Governor",
      "file": "prompts/runtime_completion/08_R7_VOICE_WAKE_STT_TTS_RESOURCE_GOVERNOR.prompt.md",
      "dependencies": ["R2"],
      "completion_gate": "Push-to-Talk remains reliable; optional real wake word, bilingual STT routing, turn completion, barge-in, TTS fallback, and model resource governance meet live hardware latency, quality, privacy, and soak gates.",
      "state_outputs": [
        "ledger/runtime_completion/current-state.json",
        "ledger/runtime_completion/capability-matrix.json",
        "ledger/runtime_completion/EVIDENCE_INDEX.md",
        "anti_amnesia/runtime_completion/session-handoff.json"
      ],
      "optional_context": [
        "Sources/AuraAudio",
        "Sources/AuraSTT",
        "Sources/AuraAgent/Conversation.swift",
        "Sources/AuraAudio/ChatterboxTTSEngine.swift"
      ]
    },
    {
      "order": 9,
      "id": "R8",
      "name": "Memory, Personalization, and Explainability",
      "file": "prompts/runtime_completion/09_R8_MEMORY_PERSONALIZATION_EXPLAINABILITY.prompt.md",
      "dependencies": ["R2", "R3"],
      "completion_gate": "Memory and context materially improve dialogue and tools while preserving provenance, bounded context, contradiction handling, retention, user inspection, correction, export, and deletion controls.",
      "state_outputs": [
        "ledger/runtime_completion/current-state.json",
        "ledger/runtime_completion/capability-matrix.json",
        "ledger/runtime_completion/EVIDENCE_INDEX.md",
        "anti_amnesia/runtime_completion/session-handoff.json"
      ],
      "optional_context": [
        "Sources/AuraMemory",
        "Sources/AuraContext",
        "docs/decisions/ADR-026-provenance-graph-memory.md",
        "docs/decisions/ADR-027-deep-context-reconstruction.md"
      ]
    },
    {
      "order": 10,
      "id": "R9",
      "name": "Product UI, Accessibility, and Onboarding",
      "file": "prompts/runtime_completion/10_R9_PRODUCT_UI_AND_ACCESSIBILITY.prompt.md",
      "dependencies": ["R4", "R5", "R6", "R7", "R8"],